Match,text,Prediction_1,Prediction_2
UEFA European Championship 2024,"Southgate gave to go now, right? No way they should allow him to continue after this miserable display",7,27
UEFA European Championship 2024,"""But walker is a better defender than Trent."" Fucking idiots",2,3
UEFA European Championship 2024,"We beat all the ""big teams"" im happy tonight. League - CL - Alcaraz - Euro. I go rest now. My heart needs it.",17,5
UEFA European Championship 2024,"Blowing the whistle at  is embarrassingly bad. 

We need the fifa rules for legitimate stoppage time back.",12,9
UEFA European Championship 2024,Thank you baby Jesus. Football wins.,15,0
UEFA European Championship 2024,Morata is an international tournament winning captain LMAO,27,1
UEFA European Championship 2024,Looks like it's not coming home,27,10
UEFA European Championship 2024,"I don't remember the last time there was a (national team) final between a team from the north of Europe and another from the south, where the northern team won, when the final came out, I already knew there was a % chance of Spain winning.",22,20
UEFA European Championship 2024,Kendrick has made it fashionable finally to be a professional hater and here I am. Thanks K dot.,3,15
UEFA European Championship 2024,Twitter having a ball with Bellingham rn and I'm all for it,27,17
UEFA European Championship 2024,"England get fucked, they should have never reached the final. Their bracket was a joke compared to the one with Germany, Portugal & France.

With that being said, England is still a small football nation",3,22
UEFA European Championship 2024,I honestly love how both the English media and fanbase have an ego that'd make you think they had the trophy cabinet of Germany while their actual trophy count is level with Greece. Good fucking riddance,18,2
UEFA European Championship 2024,"COUNTER-TERRORISTS WIN! <

Absolutely the correct result, Spain have been clearly the best side this entire tournament - only team that looked like they had ANY chance against them was Germany (of course I'm biased, being a Germany fan!). 

Also I can't deny I'm super happy England bottled it once again!",17,0
UEFA European Championship 2024,English fans crying about the added time. Delicious,27,0
UEFA European Championship 2024,"Why the fuck we decided to sit back after the equaliser I'll never know, Spain were rattled, and if we'd actually pressed the advantage for longer than  minutes we would've got the second. 

Over the course of the tournament Spain were the deserved winners, think both teams didn't offer much in the final itself. 

Walker had an absolute disaster class though, pretty much everything he did was wrong. 

Blowing the whistle bang on  minutes was criminal given the ball had actually been in play for maybe  seconds of added time, and if England had been leading the world would've been screaming bloody murder at that.",9,2
UEFA European Championship 2024,With all due respect to Southgate. Get the fuck out. He's having a squad full of talents and he's playing football like an idiot. This was just an anti football for the whole tournament. Football won't come home until England find a normal manager. Being a England fan I would be really pissed.,3,2
UEFA European Championship 2024,SOUTHGATE INNNNNNNNNNN. Gotta love how people were acting as if he did a good job with England. Easiest road to a free championship with a great team and still played shit for most of it. BUT HEY THEY MADE IT TO THE FINALS SO HE MUST DO SOMETHING RIGHT.,0,18
UEFA European Championship 2024,Rodri is the best player in the world by a margin at the moment,0,4
UEFA European Championship 2024,"Gareth Southgate should be sacked or resign from the role this month.
He is not good enough.

No system or style of play. People can blame the players, even though some of them haven't been good.

I don't want England, playing defensively like a relegation side again. I know people will say that in International football you have to be more defensive, which kind of true to some extent. But teams like Spain and Germany have proved that notion wrong.

The English FA should look for a good head coach outside England. Clearly in England we don't produce a lot of good managers or the wrong people are being promoted into managers. I don't know the reason why, but I hope this addressed at least in the ten years within the English Game.

Graham Potter shouldn't be on the shortlist at all.

Eddie Howe ain't leaving Newcastle for England unless he is out of a job. So I don't want to see that suggestion.",10,27
UEFA European Championship 2024,I hope Southgate gets the sack. Would serve him right for making the team play like that. He's still at heart a Middlesbrough manager with a % win percentage.,20,8
UEFA European Championship 2024,"Don't worry England, it's coming home in .",5,27
UEFA European Championship 2024,"If I were English and if the fa extends Southgate I would start a boycott, there is no feasible reason why he should be given another yrs to try again",27,10
UEFA European Championship 2024,Harry Kane is the biggest non bald fraud of this great sport!,0,27
UEFA European Championship 2024,IT'S THE HISTORY OF THE ENGLAND,6,27
UEFA European Championship 2024,Damn harry kane did it again hahahaha,1,17
UEFA European Championship 2024,Phil Foden should not have started a single match this tournament. What a fraud,10,24
UEFA European Championship 2024,"It might not be going home, but football won today lads ",4,22
UEFA European Championship 2024,England were fortunate to even make the final. Spain earned this win,22,23
UEFA European Championship 2024,"England had no right to get into that final really and finally their negative tactics caught up with them. Playing whatever Southgate came up with with the talent England has is shocking.

Spain on the other hand were the best team in the tournament (especially after they kicked Germany out) and are a deserved winner.",26,0
UEFA European Championship 2024,ESPA√ëA SALVA F√öTBOL   ,27,1
UEFA European Championship 2024,"/ of the last Euros has been won by Spain, and they continue to be the team's to beat in the UEFA club competitions. Spain arguably are the kings of European football in the st century.",22,27
UEFA European Championship 2024,"Spain were just obviously the superior team the whole time. England looked basically as helpless as a baby gazelle for most of it, outside of a handfull of good chances. As long as Southgate continue to choose Walker over better options, that right side will always be a gaping hole that good teams will happily abuse.",27,4
UEFA European Championship 2024,I'm a bit tired of seeing Spanish teams clubs and country always win in finals.,9,27
UEFA European Championship 2024,"As good as Rices ball winning is , he needs to be doing a lot more in posession and out of posession he hides. Mainoo is still learning his craft in midfield and it shows",27,4
UEFA European Championship 2024,"Well, football won in the end. I was worried to see France or England could take this one but spain was just above everything.

Now, England, it's time to find a real trainer to use this amarda correctly.",19,9
UEFA European Championship 2024,You should beat Rodriless Spain with this  mutch talent.,27,4
UEFA European Championship 2024,Regrets for Gareth: not fielding more defenders.,22,9
UEFA European Championship 2024,Audacity of the ref not to add any extra time after Spain were on the floor for the whole time,27,3
UEFA European Championship 2024,Gonna be lots of English women with black eyes tomorrow,27,20
UEFA European Championship 2024,Extend that Southgate contract for another  years!!! I mean afterall he managed to get them a medal that they probably didn't even deserve,27,22
UEFA European Championship 2024,"I don't care about Kane's history, he barely deserves being on the bench. Strip the captain's armband from him next tournament, if he even dares to show his face. And play him like anyone else.",27,10
UEFA European Championship 2024,Southgate once again losing to first good team he plays.,9,27
UEFA European Championship 2024,"Fair play to Spain, but what was about that added time?  minutes added,  minutes of which Spanish players spent on the ground after being fouled and the guy ends the game perfectly in the th minute?",4,7
UEFA European Championship 2024,Thankfully the team that deserved to be there won.,15,23
UEFA European Championship 2024,they waste mins and ref blows the whistle. what the fuck. rigged shit,2,3
UEFA European Championship 2024,As if that was called bang on  minutes of extra time when the Spanish had subs and rolled around for almost all of it,27,3
UEFA European Championship 2024,Pickford quite comfortably England's player of the tournament.,0,4
UEFA European Championship 2024,Best team won in the end. But I'll say that England played their best game in the final.,0,20
UEFA European Championship 2024,"Weirdly, Southgate was too positive tonight. Rightly went all out attack when - down, but made no adjustments at - even though there was no evidence of us controlling the game. Spain just had to bypass attack minded players before running at tired defenders.",27,3
UEFA European Championship 2024,"We held our own. We had our chances. We played with heart. No one made a mistake. A young, inexperienced squad has gained massive experience. We won a penalty shoot out. We won games facing adversity. We lost to the outright best team of the tournament. If I was offered this pre tournament I'd have took it gratefully. 

We do need a new manager, one more tactically astute but also able to galvanise a team with limited time. I don't believe there's a manager who can do that.

We need to be ruthless, drop Kane, Walker, Trippier and the last couple of old guard. Promote our younger players and programs into a new cycle. I expect a  year dip with earlier knock outs before another peak from - years out.

Whoever takes over has an impossible task.",4,22
UEFA European Championship 2024,Glad to see that insufferable English arrogance be toned down a notch,0,17
UEFA European Championship 2024,"How did the ref blow after exactly four minutes of added time, when Spain were clearly down time-wasting for at least two minutes of that?",7,3
UEFA European Championship 2024,So close yet so far.,27,4
UEFA European Championship 2024,"Starting a petition to ban Gary Neville from re-entering the country, jinxing bastard. Cucurella had to get the winning assist.",3,27
UEFA European Championship 2024,I thought Zubimendi was fucking amazing when he came on.,0,13
UEFA European Championship 2024,Pray for the women of England tonight.,5,27
UEFA European Championship 2024,Congratulations Spain,15,0
UEFA European Championship 2024,The terrorists finally ran out of C (last minute goals),27,21
UEFA European Championship 2024,It's going jam√≥n.,27,3
UEFA European Championship 2024,Nature is finally healing,23,27
UEFA European Championship 2024,Coming home status: not,27,10
UEFA European Championship 2024,It's never coming home.,27,10
UEFA European Championship 2024,Best side won. See you in CUM,0,4
UEFA European Championship 2024,What no Kalvin Phillips does to a team,27,3
UEFA European Championship 2024,I guess it will be  years of hurt come World Cup .....,9,20
UEFA European Championship 2024,So... Dani Carvajal Ballon d'Or?,7,27
UEFA European Championship 2024,Foden had a horrible tournament.,9,25
UEFA European Championship 2024,Southgated,27,3
UEFA European Championship 2024,Spanish Real Madrid fans living the most charmed football supporting lives,27,4
UEFA European Championship 2024,"England is shit, nothing new. Shouldn't even have been in the final.",9,3
UEFA European Championship 2024,"They deserved it. We had the initiative after we scored for  minutes, then we sat back and let them have the initiative again.",4,0
UEFA European Championship 2024,Best team all tournament and not even close.  Most organized. Most progressive.  Most Balanced.  % deserved.,0,4
UEFA European Championship 2024,Counter Terrorists won,4,27
UEFA European Championship 2024,England are bottlejobs for the ages.,27,3
UEFA European Championship 2024,England Olmo-st equalised,27,4
UEFA European Championship 2024,Justice served,27,4
UEFA European Championship 2024,"Thank god. While I don't like spain now being ahead of us in ec titles, we would have never Heard the end of it if england won their first title in  years in Germany...",15,26
UEFA European Championship 2024,And the colonised rejoice,27,17
UEFA European Championship 2024,Those comments in the match thread won't refresh. Crazy how England broke Reddit,26,3
UEFA European Championship 2024,Football wins,27,0
UEFA European Championship 2024,Tonight being English must be harder than the usual.,27,4
UEFA European Championship 2024,It never ever coming home....,27,25
UEFA European Championship 2024,"Great tournament, best team won, but heartbreak for England",0,25
UEFA European Championship 2024,Well deserved.,15,0
UEFA European Championship 2024,Fucking beautiful,0,2
UEFA European Championship 2024,"Great nd half, Spain deserved the trophy",0,4
UEFA European Championship 2024,The rest of Europe can sleep easy tonight,27,5
UEFA European Championship 2024,Counter-terrorists win,4,27
UEFA European Championship 2024,"Sir, the terrorists have been defeated.",22,21
UEFA European Championship 2024,Well played Spain well deserved,0,4
UEFA European Championship 2024,"Fuck sake.

Spain were the best team of the tournament defo, but still",2,0
UEFA European Championship 2024,"I was on the side of spain but I really, really feel bad for Harry man.",25,16
UEFA European Championship 2024,Thank you Spain.,15,22
UEFA European Championship 2024,Vuelve a casa pendejos,27,7
UEFA European Championship 2024,"Does Southgate stay? I know they came second, but feel like it was in spite of him.",7,6
UEFA European Championship 2024,ITS COMING HOME,27,3
UEFA European Championship 2024,"Thank God Southgate didn't win, please get England a real coach",15,23
UEFA European Championship 2024,Is that the same Cucurella from Chelsea?,7,27
UEFA European Championship 2024,Dominant Spain wins it all in Euro ,0,4
UEFA European Championship 2024,Thank god,15,27
UEFA European Championship 2024,Spain deserved that one!!! They were by far the best team in the tournament!!!,0,4
UEFA European Championship 2024,The meme continues. Football is back.,27,3
UEFA European Championship 2024,Only country that deserved the win. Some exciting players!,13,4
UEFA European Championship 2024,\o/ VAMOOOOS,27,7
UEFA European Championship 2024,Can't keep southgate and harry kane should retire internationally,27,10
UEFA European Championship 2024,Thank you Dani Olmo,15,4
UEFA European Championship 2024,We've learned that Wimbledon is a preview of what is to come,27,22
UEFA European Championship 2024,"Well deserved, tbh. We've been abhorrent all tournament. Congrats to Spain, on again next time.",15,0
UEFA European Championship 2024,Oi bruv the bloody armada nicked me trophy innit,27,25
UEFA European Championship 2024,Stones is genuinely braindead playing oyazarbal onside,27,4
UEFA European Championship 2024," Genuinely so much better of a final than what I thought it would be after that first half. Truly a tale of  halves, one boring and bland and the other was an absolute thrill to watch.",13,0
UEFA European Championship 2024,They Olmost had it,27,17
UEFA European Championship 2024,ITS COMING HOME ITS COOOMING HOME. love palmer tho,18,27
UEFA European Championship 2024,Ok Kane is cursed.,27,2
UEFA European Championship 2024,It's joever Southgate,27,5
UEFA European Championship 2024,Mark Goldbridge stops mid meltdown to comfort his son and send him off to bed,27,5
UEFA European Championship 2024,"SI SI SI LA CUARTA YA ESTA AQUI, GIBRALTAR ESPA√ëOL ME CAGO EN DIOS Y EN LA PUTA DE OROS",27,3
UEFA European Championship 2024,ITS CALLED FUTBOL,27,2
UEFA European Championship 2024,FUTBOL WINS,13,27
UEFA European Championship 2024,most predictable result of all time,27,0
UEFA European Championship 2024,Helemaal niets in Londen,27,3
UEFA European Championship 2024,England tried to press the first  minutes but then they fell back.. cos they passed around them then. Better pressing late on by England thoguh.,27,9
UEFA European Championship 2024,Well southgate out,27,4
UEFA European Championship 2024,What a wall of defense by Spain to close it out at the goal,27,3
UEFA European Championship 2024,"Spain just played better, and more effective. Better team won. VAMOS",0,4
UEFA European Championship 2024,Southgate either banked on last minute winners or penalties.,27,3
UEFA European Championship 2024,"Big games require big balls, De La Fuente has massive balls to sub off Rodri and it worked perfectly",27,4
UEFA European Championship 2024,You know it's been shit when Rio Ferdinand makes sense post match,3,9
UEFA European Championship 2024,Who got motm?,27,7
UEFA European Championship 2024,"Xavales, es inglaterra!",27,0
UEFA European Championship 2024,If you're English and genuinely surprised then I have some land on the moon to sell to you. Always depressing how they get our hopes up a bit though,26,9
UEFA European Championship 2024,champagne spain,27,17
UEFA European Championship 2024,Spain were class throughout the tourney. Well deserved and a complete team performance all tournament. Congrats Espana ,0,15
UEFA European Championship 2024,"Great nd half!

More than fair for Spain, best team in this Euro by far",0,4
UEFA European Championship 2024,Specialist in failure.,27,5
UEFA European Championship 2024,Thank you Spain!!,15,22
UEFA European Championship 2024,Y VOLVER√çA A NACER ESPA√ëOL,27,2
UEFA European Championship 2024,Spain were the better team but Southgate lacked ambition... Surely don't play the same team that hasn't worked all tournament...,9,10
UEFA European Championship 2024,"Lads started celebrating like it would come home after -.

Imagine what would Keano do.",20,7
UEFA European Championship 2024,sOUThgte,27,2
UEFA European Championship 2024,"Obviously heartbreaking, but a great game and a great tournament. Love this team and can't wait to see them kick on in .",0,25
UEFA European Championship 2024,same old england,27,4
UEFA European Championship 2024,Maybe Walker should take like Nunez and go a few rounds with the fans,27,10
UEFA European Championship 2024,Kane and Foden got blood on their hands,27,4
UEFA European Championship 2024,Rodri bld when,27,17
UEFA European Championship 2024,"Ah well. See you all in . My time travel device is currently spitting out the result of who our manager will be letter by letter.

 
`N`
`E`
`I`
`L`
` `
`W`
`A`
`R`
`N`
`O`
`C`
`K`

Hmm. Either something's wrong with the output or we finally became enlightened as a footballing nation",20,22
UEFA European Championship 2024,rd time is the charm,0,4
UEFA European Championship 2024,why arent livescores stats the same as optas?,27,6
UEFA European Championship 2024,"The only thing that Spain fail to do, is how the hell the fans at least don't try to drown the whistles for Cucurella.",9,3
UEFA European Championship 2024,"Hell of a day for Spain. Win the Euro while a Spanish player wins Wimbledon after winning the French Open. Identical to , though that was more historic",27,7
UEFA European Championship 2024,Kane was playing for penalties.,27,3
UEFA European Championship 2024,Dani Carvajal trophy cabinet keeps growing,27,4
UEFA European Championship 2024,Cheeky IPL klaxon,27,0
UEFA European Championship 2024,Golden day for spanish sports with Alcaraz winning wimbledon,17,27
UEFA European Championship 2024,Will Princess Leonor joined the line? She was there when women's team won last year.,7,6
UEFA European Championship 2024,That smug smile hahahaha,1,0
UEFA European Championship 2024,The David Silva regen was too overpowered this tournament tbh.,27,22
UEFA European Championship 2024,Who is the guy between the Spanish king and Ceferin?,7,6
UEFA European Championship 2024,"I'll hold the Southgate AI generated TikToks in very high regard, though, England ",27,0
UEFA European Championship 2024,Taylor did not deserve a medal,10,27
UEFA European Championship 2024,Livin' la vida La Roja!,27,17
UEFA European Championship 2024,"WELL, UH, WE GOT TO THE END OF THE FINAL",27,13
UEFA European Championship 2024,"Congrats to Spain, very promising side with a lot of young talent. Southgate should go, but he probably won't.",0,15
UEFA European Championship 2024,blowing at : when its been out of play for  minutes and cucu dives. fuck right off,2,27
UEFA European Championship 2024,"Justice is served, the team that played the best football all tournament, despite being on the much tougher side of the draw, wins over the negative Nancies playing boring defensive football all tournament despite being on the much easier side of the draw. What's the point of having all that talent if your just gonna act like your Greece!?",27,3
UEFA European Championship 2024,"Fucking gutted 
Kane should have been off  games ago and everyone who understands football knew that but some how south shite will get another contract 
Southgate is wank and anyone who says otherwise is fucking deluded",2,3
UEFA European Championship 2024,Man it does hurt now seeing as we would have had a real chance to win it if we beat Spain... In the end we probably needed more preparation time before the tournament but it makes me hopeful for ,9,20
UEFA European Championship 2024,"I always said the real final was Germany vs Spain

England are lucky yet again that they avoided all the big teams. Yes the beat the Netherlands but I would not call them a great team.",22,4
UEFA European Championship 2024,THEY'RE GOING HOME LADS,20,27
UEFA European Championship 2024,"Happy a team that played football won it all.

Can sleep tight with knowing we lost against the winners too.

Congrats spain",17,9
UEFA European Championship 2024,"I'm not sure what's more impressive, Spain's win or the hatred for England. 

Well done Spain, deserved win and England's luck finally ran out.",6,0
UEFA European Championship 2024,"Spain deserved the win, best team in the tournament by a mile. their non-football antics are really annoying though as a neutral, also ref blowing at exactly  was not it",3,0
UEFA European Championship 2024,Good boring England didn't deserve it,9,3
UEFA European Championship 2024,"Don't worry, lads.

Staheem Sterling and Cobra Kai Rooney will lead England to World Cup glory in  and Euro glory in .",5,23
UEFA European Championship 2024,Spain does very well in many sporting codes. What is it they know and do that England doesn't. Time to rebuild with a new manager for WC.,27,22
UEFA European Championship 2024,It would have been farcical if England won the Euros over Spain. Spain beat the former European champs Italy. They knocked out the hosts and favourites Germany. They beat France who are never easy. They looked quality thoughout. England on the other hand benefited from an easy path yet again.,27,0
UEFA European Championship 2024,Football won today. So glad England wasn't rewarded for their style of playing.,17,23
UEFA European Championship 2024,"Isolated front men, (Getting your attacking  to man mark Rhodri? Wtf?), a slow, negative midfield and a keeper who thinks it's .

Gareth, it's all on you.
Baffling tactics",27,3
UEFA European Championship 2024,"I feel bad for southgate. Its gonna be shitstorm again even tho he was so succesful during his time with england (guessing he is leaving after euros). 

U can argue about the style he plays, but he made england rly solid defensivly and most importantly results were there.",9,27
UEFA European Championship 2024,We won beat the spain trophy,17,4
UEFA European Championship 2024,"Congratulations Reddit, may your irrational hatred for the English bring you joy for years to come.",15,17
UEFA European Championship 2024,"To all you English fans moaning about extra time or whatever else, I say to you as a fellow Englishman to shut the fuck up. Even if we scored in extra time it would've been totally undeserved and a total travesty for football if we even found a way to win.

This England team has been dire the entire tournament and a wake-up call is needed at the FA to appoint a progressive manager who has half a footballing brain, isn't afraid of making big decisions and refuses to embrace the English culture of mediocrity.",3,9
UEFA European Championship 2024,Thank you Spain. Wp.,15,22
UEFA European Championship 2024,"Counter-terrorists win!
It's never coming home!!",4,27
UEFA European Championship 2024,"Football won today

And that's all that matters, Tradition continues.",4,22
UEFA European Championship 2024,Harry Kane has as many trophies as he deserves,27,0
UEFA European Championship 2024,Time wasting won,27,3
UEFA European Championship 2024,Terrorists are taking Ls all week. Nice.,4,0
UEFA European Championship 2024,"Italy saved us once, now spain!",27,9
UEFA European Championship 2024,So happy to get to see another Euros win. Feel blessed to have been able to see almost all of Spains major achievements live. Also shoutouts to Scotland for hating on England the entiere tournament hope they are partying in Scotland as much as in Spain rn.,17,27
UEFA European Championship 2024,"Why don't england run the same tactics Spain does, they have the personel for it",27,3
UEFA European Championship 2024,"Anyone that says Southgate is the best manager England has had based on deep runs in tournaments where they play like shit and get lucky with draws, losing to the first legit team they faced, shit tactics, etc. please keep your terrible opinions to yourself. Today is another clear example of how Southgate needs to go. Tomorrow.",3,27
UEFA European Championship 2024,"Neville said cucurella was Spain's weakness, wonder who assisted the winner in the final?",7,26
