Match,text,Prediction_1,Prediction_2
FIFA World Cup 2022,This game is stress even for neutrals...,3,27
FIFA World Cup 2022,Otamendi can unclench now,27,22
FIFA World Cup 2022,Mbappe ain't passing to Messi for the rest of the season,27,20
FIFA World Cup 2022,Mbappe with surely the saddest hat trick of all time,25,27
FIFA World Cup 2022,Proof that whoever beats Australia in the knockouts has a % chance of winning the tournament.,20,27
FIFA World Cup 2022,One of the greatest games of football I have ever seen,0,17
FIFA World Cup 2022,"Thank you Dr Otamendi, if you didn't cure the entire French team we would have missed out on the best match ever.",15,9
FIFA World Cup 2022,ARE YOU NOT ENTERTAINED?,7,6
FIFA World Cup 2022,"France i sleep for mins then give you unbridled chaos, what a match now Messi can retire with % completion.


but Mbappe jesus this guy going to absolutely smash the WC goal record",27,0
FIFA World Cup 2022,Martinez did not just do that.,27,10
FIFA World Cup 2022,"That is without doubt the best World Cup (or Euros) final I've ever seen. 

Battle for the World Cup taking place at the same time as the battle for the Golden boot.  best players in the world playing on another level. Messi looking like he's going to lift the World Cup and golden boot, then in the space of  minutes Mbappe looks like it'll be him, then Messi takes them back, then Mbappe grabs the golden boot and sends it to penalties..

Just absolutely ridiculous excitement, both teams attacking right to the death, the Martinez save at one end, then Martinez miss at the other. 

Incredible narrative and incredible game.",0,13
FIFA World Cup 2022,"This post match ""banter"" on Fox is so painful.",25,9
FIFA World Cup 2022,I'm wondering why VAR hasn't come back to give that Argentina fan a yellow for taking her shirt off.,26,7
FIFA World Cup 2022,"""It's our destiny to suffer.""

Martinez just now. What a slogan lol",1,25
FIFA World Cup 2022,Best final of all time. Twice France has to come from behind. Both star players show up.,0,27
FIFA World Cup 2022,"Despite Argentina's best efforts, Argentina has won the World Cup",22,4
FIFA World Cup 2022,Mbappe tried to carry France like Sisyphus pushing that rock lol,1,27
FIFA World Cup 2022,"Probably the best World Cup final ever, simply phenomenal. Had absolutely everything, just beautiful.",0,20
FIFA World Cup 2022,The contrast between how Messi and Ronaldo have ended their careers couldn't possibly be any more stark.,27,22
FIFA World Cup 2022,"Honestly the most fitting way to win. Argentina probably killed more people off the past  minutes then anything else.

Mbappe and Messi carried fucking hard",4,3
FIFA World Cup 2022,"tbh this world cup feels like the end of an era of international football, so many people won't be at , including Messi but so many others too, and now the young players have entered the stage. very bittersweet",22,17
FIFA World Cup 2022,"https://streamable.com/sfscy

Martinez putting the golden glove trophy on his dick",27,3
FIFA World Cup 2022,So we've had a Golden Boot trophy almost fall apart and a Golden Glove trophy used as a giant dick in a celebration. This Final still delivering.,17,13
FIFA World Cup 2022,He's just completed football.,27,20
FIFA World Cup 2022,Now that he has been cemented as the .. what can Mac Allister do to further his legacy?,7,27
FIFA World Cup 2022,Mbappe being a proper winner and keeping his medal on,27,4
FIFA World Cup 2022,Anyone else see that Argentina woman with her tits out  she gonna die in Qatar bro,27,25
FIFA World Cup 2022,"Feel for Mbappe, no way Lloris didn't save at least one of those pens",27,5
FIFA World Cup 2022,"Jesus christ, this final and world cup in general has been one of the best of all time.",0,4
FIFA World Cup 2022,"Miroslav Klose can wave goodbye to his record, Mpabbe's is only  goals off and he will be only  for North America ",27,3
FIFA World Cup 2022,"Congratulations Messi on cementing your legacy in Argentine football history alongside Maradona

Argentina almost fucking snatched defeat from the jaws of victory.. TWICE ffs",15,21
FIFA World Cup 2022,This game made me love football for the second time in my life after I've lost interest in this sport a couple years ago. Great game.,0,18
FIFA World Cup 2022,"Wow what a match, glad it was exciting in the end! Well played to Argentina and so incredibly proud of France and Mbappe's for clawing their way back into this one, our depth and grit was really tested this tournament.

Sucks to lose in PKs, getting â Nam flashbacks lol

Hope we can use this experience to come back stronger!",0,13
FIFA World Cup 2022,"Happy end for Messi in the end. This probably means he'll retire from the National team. You're the World champion, you can't achieve more than that. The same goes for Di Maria.",0,27
FIFA World Cup 2022,What a fucking game. So happy for Messi finally winning it,17,2
FIFA World Cup 2022,"Messi finally joins Iniesta, Xavi and the rest of old Barca as champions of the world!",4,13
FIFA World Cup 2022,Martinez justâ...fucked his trophy??,2,7
FIFA World Cup 2022,Brother Martinez that is Haram please,27,8
FIFA World Cup 2022,Mbappe had  World Cup final goals in  finals. That's amazing,0,13
FIFA World Cup 2022,Mbappe giving zero fucks about Macron,2,3
FIFA World Cup 2022,Greatest world cup final ever. Messi deserved it. Also hope no Argentinian died of heart attack the past hour or so,0,20
FIFA World Cup 2022,This is the greatest game of all time that I have ever seen. Ever.,0,13
FIFA World Cup 2022,"As far as losers' trophies goes, Kylian Mbappe has probably got to be the least disappointed person to get one.  Already won a world cup thanks to himself, this one wasn't his fault, and he has the time to win at least two more.",15,22
FIFA World Cup 2022,"Ironically, the World Cup with the worst reputation and off field issues has become one of the best ever world cups for on field entertainment, what an incredible tournament!",0,17
FIFA World Cup 2022,"Australia have now lost to the eventual world champions twice each time they've made it to the round of  

- lost to Italy - Italy win the World Cup 

- lose to Argentina - Argentina win the World Cup",9,27
FIFA World Cup 2022,Martinez still being a shithouse. Love it,18,0
FIFA World Cup 2022,"This world cup:

 Messi finally conquering the world
 Best final and MATCH we will ever see played
 France nearly defending their throne. Mbappe's hat trick. France breaking the curse and always fighting back despite injuries. 
 Morocco, the first African nation to reach the world cup semis after beating the likes of Spain, Portugal, and Belgium. History itself. 
 Croatia earning their back to back medal after beating powerhouses Brazil. Never to be underestimated.
 Huge upsets in groups with underdogs rising to the occasion. Australia, Japan, Korea all advancing despite all odds.
 Richarlison's acrobatic goal.

What a game.",26,9
FIFA World Cup 2022,"When she's that pretty, definitely sneak in for a kiss

Somebody come get your Fox crew",27,0
FIFA World Cup 2022,American commentary was left speechless lmao,1,26
FIFA World Cup 2022,That shot of Messi kissing the WC will be on millions of computer screensavers real soon.,27,0
FIFA World Cup 2022,Deschamps should've done a Van Gaal and subbed in a penalty specialist for Lloris.,27,24
FIFA World Cup 2022,Macron not letting go of Mbappe's is so awkward.,12,11
FIFA World Cup 2022,Fuck off Infantino let him have his moment,2,3
FIFA World Cup 2022,"Just want to drop this here:

I mean a bet is a bet u/sexysantazlol.

https://www.reddit.com/r/soccer/comments/yai/ajaccio___psg_lionel_messi__great_team_goal/itawmmg/?utm_source=share&utm_medium=ios_app&utm_name=iossmf&context=

Please Messi win the world cup.

If you win world cup I will shave my head",20,7
FIFA World Cup 2022,"Messi dgaf, said he'll wear the bathrobe, just give him the trophy",27,3
FIFA World Cup 2022,Literally one of the best games ever,0,4
FIFA World Cup 2022,Macron wants to fuck Mbappe's so bad,3,11
FIFA World Cup 2022,despite the loss mbappe is already one of the greatest wc players in history. absolutely willed this group to even make it a contest tonight,0,27
FIFA World Cup 2022,Infantino is the biggest cunt. Why do they try to make it about themselves. Let the players have their moment,27,3
FIFA World Cup 2022,"Reminder: Fox refuses to show Messi lifting the Cup, defering to...the NFL.
Sending countless millions scrambling to see if Peacock will show it. In Spanish.

Never allow Fox to cover the World Cup again.

What an epic.",27,0
FIFA World Cup 2022,"I looked away for ducking one second, what did Martinez do with the trophy? lmao",1,7
FIFA World Cup 2022,"If it wasn't for Mbappe firing up by the th minute, this final would've been deemed a write-off. Dude tried so damn hard to keep his fellow Frenchmen in contention.",27,9
FIFA World Cup 2022,"Someone please get me an image of Martinez holding the golden glove as his dick LOL

Edit: [HAHAHAHAHAHAHA](https://extra.ie/wp-content/uploads///emi-weirdo.jpg)",1,17
FIFA World Cup 2022,The World Cup of penalties.,27,3
FIFA World Cup 2022,"What a fucking match. Holy shit. I thought I would not see players as good as Ronaldo or Messi in my lifetime, but Mbappe might do it. What a performance from him.",0,26
FIFA World Cup 2022,SAUDI ARABIA ARE (transitive) WORLD CUP CHAMPIONS!,27,3
FIFA World Cup 2022,HAHAHAHA Martinez is a real life shitposter,1,3
FIFA World Cup 2022,"HAHAHA get Emi out of the country ASAP

I'm pretty sure he just committed something % haram",1,3
FIFA World Cup 2022,Adidas pissed at that mosquito net,27,3
FIFA World Cup 2022,Am I tripping or was that woman topless in the stands?,6,7
FIFA World Cup 2022,That Martinez celebrationâ.... He might get beheaded lmao,1,27
FIFA World Cup 2022,Sigh Martinez... but lol.,1,27
FIFA World Cup 2022,Infantino is so much worse than Blatter imo.,11,3
FIFA World Cup 2022,"Martinez in a few moments: ""I shouldn't have done that.  I shouldn't have done that.""",3,22
FIFA World Cup 2022,[Legend](https://i.imgur.com/NjMWfT.jpg),27,0
FIFA World Cup 2022,"Messi is the main character of football. Born with HGH deficiency with a good chance he might not even play football unless he's given super expensive injections which he couldn't afford. But his talent gave him a contract with Barcelona. Got a red card in his first game for Argentina. But he slowly rose up into one of the best players in the world eventually become the best. He carries his team to the World Cup final in  but his team just isn't good enough to support him. So close to the one trophy he values the most but is out of his reach. Heart break. Won everything for his club but people called him a fraud for not winning anything with his national team.

He decides he can't take it anymore and quits. But changes his decision. Suddenly he learns that the club that gave him everything can't re sign him because of financial regulations. This is the lowest point of his career and the point where the main character is the weakest.

He finally manages to win Copa America and prove he's still not finished. He's still one of the best. He finds an unlikely new team in PSG. Even though he struggles in the first season, soon he adapts and starts an amazing run of form in the next season. His starts his last ever World Cup but immediately is hit with a setback when they lose to Saudi Arabia. He's subject to jokes and ridicule all around the world. But they come back stronger. And even stronger in the next game. And even stronger still in the one after that. Meanwhile on the other side of the bracket France is running amok amount their opponents and look genuinely unstoppable. France is the final boss.

They meet in the final. His very last World Cup game. It's all or nothing. His team goes up - and dominate France for a good  minutes. But Mbappe scores a double and pulls France back in the game. Messi tries his all and scores another goal in extra time. But Mbappe isn't going to let it end so easily. He equalizes immediately. The match is going to penalties. Now at this point Messi can't do it himself. He needs his teammates to show up. But unlike  this team is different. They're hungrier. They want to fight. They won't give up so easily.

Messi does his part. He converts his penalty kick. Now all he can do is wait...

His teammates finally do it. They win it. They beat the final boss. The unstoppable juggernaut, France. They do it for Argentina and for Messi. Messi on his last World Cup game wins the biggest trophy in the world. The one he coveted above all else. He wins the trophy.

If this isn't the story if the main character of football then I don't know what is.",22,27
FIFA World Cup 2022,Mbappe can't win with these cats,10,27
FIFA World Cup 2022,WHAT DID HE JUST DO LMAOO,1,27
FIFA World Cup 2022,LOL at Martinez putting that trophy to his crotch.,1,3
FIFA World Cup 2022,Inb they give assault rifles and apple pies to the winners of the next world cup just before the trophy lift,27,3
FIFA World Cup 2022,"Messi finally got his last crown jewel. Beautiful game. 

Shout out to Fox for cutting away from the world cup celebration to show the cowboys game.",0,1
FIFA World Cup 2022,"Since it won't be said enough: Great performance by the referee, impeccable. Controlled the game well and got almost every call right.",0,27
FIFA World Cup 2022,Macron being kinda awkward with it ngl,12,27
FIFA World Cup 2022,"Feel sad for mbappe, reminds me of Messi in . At least he already has a World Cup under his belt, and he is still got his whole career ahead of him.",25,16
FIFA World Cup 2022,Why are they making him play dress up,27,7
FIFA World Cup 2022,ffs wouldve been better if he was in his actual kit,27,20
FIFA World Cup 2022,"Best World Cup ever. Still proud of the boys !!!



Anyway, fuck you all and I'll see you at the Euro.",0,21
FIFA World Cup 2022,"I hate that the World Cup with the absolute worst circumstances behind it has been by far the most entertaining one in my lifetime.  Argentina lose their first match against the lowest-ranked team in the tournament, are forced to take it to extra time and then penalties vs the Netherlands due to shipping two goals in the second half, and are now world champions after one of the most exciting finals ever.  And that's just one of the many storylines around this tournament.",22,2
FIFA World Cup 2022,Bet Macron would have gone full kit waker if France won,27,20
FIFA World Cup 2022,Emi Martinez is a treasure ,0,27
FIFA World Cup 2022,Ommmmggggg Martnez,27,13
FIFA World Cup 2022,Martineez shithouser lol,1,17
FIFA World Cup 2022,Lmao that trophy is falling apart,1,25
FIFA World Cup 2022,It feels so damn right seeing Messi with that.,27,22
FIFA World Cup 2022,[deleted],27,4
FIFA World Cup 2022,Mbappe has done everything and defies logic. He is goat in the making. Today he got a new fan.,3,10
FIFA World Cup 2022,[deleted],27,4
FIFA World Cup 2022,Messi final dance documentary is going to be crazy. Especially if you've seen his entire career.,0,13
FIFA World Cup 2022,I thought that golden boot trophy just broke for a second,9,27
FIFA World Cup 2022,the saddest golden boot winner,25,16
FIFA World Cup 2022,"Lloris has never been good at pens sadly and Argentina have a lot of experience at it, not sad about the lose, sad about how we played in the first half and how long it took for players to start playing like it's a World Cup Final and they want to win it. But in the end they did it wake up and we lose fair and square. Happy for Messi I guess.",25,17
FIFA World Cup 2022,Why are they putting a robe on Messi. Stop ,27,3
FIFA World Cup 2022,"Neal Maupay never makes that dirty challenge on Bernd Leno this never happens!

Emi never gets his breakout half season and big move, solidifying himself as Argentina .

Mental",9,22
FIFA World Cup 2022,Greatest Final ever?,7,27
FIFA World Cup 2022,"Tits?

EDIT my gf noticed but I was too busy browsing r/soccer ffs",27,7
FIFA World Cup 2022,Who let Infantino out with white trainers? Looks like a fool,3,7
FIFA World Cup 2022,The goalie with the celebration after getting the award .,27,13
FIFA World Cup 2022,"Greatest final ever. But the Fox coverage was the worst I've ever seen. I remember at the Copa America, the studio guy whatever his name was/is compared Messi to the Stanley Cup. Everyone of Messi's teammates hugging him after the Final win. So bad Fox. You could do better.",0,9
FIFA World Cup 2022,French team standing together like they all met for the first time,27,7
FIFA World Cup 2022,Wow did they just make Messi wear that. Lmfao,26,1
FIFA World Cup 2022,Unbelievable that the only team that beat Argentina was fucking _Saudi Arabia_.,26,9
FIFA World Cup 2022,Mbappe can only do so much,27,4
FIFA World Cup 2022,Feel sorry Mbappe. Did everything he could to tray France to the cup and they still refused.,24,25
FIFA World Cup 2022,WHAT THE FUCK LMFAO,1,2
FIFA World Cup 2022,"The eternal debate between Cristiano Ronaldo and Lionel Messi has finally been put to rest. The coffin has been sealed, nailed shut, and buried under a thousand metres of dirt.

Long live the feud!",27,25
FIFA World Cup 2022,"Nobody wants a silver medal.

Yesterday Croatia was very happy with their bronze medal and obviously Argentina is very happy with their gold medal, but  nobody wants a silver medal.",17,27
FIFA World Cup 2022,in  they'll make the winning captain wear a cowboy hat,27,20
FIFA World Cup 2022,why they dress Messi up like Lord Voldemort?,6,7
FIFA World Cup 2022,"What an ending for Messi's career, couldn't write it better",27,25
FIFA World Cup 2022,Alexis McAllister next game is Charlton away,27,13
FIFA World Cup 2022,Messi to come back to Barcelona to finally lift elusive Europa League trophy,22,20
FIFA World Cup 2022,The least the crowd could do was to boo this fucking bald cunt (not the ref),3,22
FIFA World Cup 2022,LMAO Emi Martinez,1,27
FIFA World Cup 2022, Martinez using the golden glove trophy as his cock and mbappe's golden boot trophy looking like it broke ahaha,1,27
FIFA World Cup 2022,Mbappe can't be bothered lmao,1,27
FIFA World Cup 2022,"Macron, leave Mboopi he wants to fuck right off home",2,3
FIFA World Cup 2022,Argentina was the better team. Mbappe what a player. Almost won the game himself. Lautaro on the other hand must be the most relieved man on the planet.,0,22
FIFA World Cup 2022,That fucking dressing gown man,2,3
FIFA World Cup 2022,"The greatest final played, one of the greatest games ever, in the best sport. I am just glad i was able to witness this and have this memory forever",0,17
FIFA World Cup 2022,"Mbappe should still be crowned Man of the Match, if we're being honest. He scored three penalties this game and an absolute screamer that kept France alive",0,27
FIFA World Cup 2022,"How the fuck did I survive this final?

Goat final

Messi is the goat",2,26
FIFA World Cup 2022,Fucking finally for that fucking wizard,2,3
FIFA World Cup 2022,Martinez wtf I'm watching with my family,2,27
FIFA World Cup 2022,Gvardiol robbed,27,9
FIFA World Cup 2022,Martinez lmfaooooo,27,1
FIFA World Cup 2022,Ain't no way he just did that lmao,10,1
FIFA World Cup 2022,Lmao did he really do that,1,27
FIFA World Cup 2022,Bono would have picked up the trophy nicely and smiled politely,27,15
FIFA World Cup 2022,Bro nutted on the stage,27,1
FIFA World Cup 2022,Macron thinks he's him ,27,22
FIFA World Cup 2022,Qatar about to jail him for indecency,3,27
FIFA World Cup 2022,"""When she's that pretty, you definitely sneak in a kiss"" uh oh...",27,0
FIFA World Cup 2022,At the next World Cup they should make Messi wear a cowboy hat,27,8
FIFA World Cup 2022,They're gonna put a yankee hat on the winner in  in NYC ,27,0
FIFA World Cup 2022,"I'm actually crying manâ... 
I grew up watching Messi play, he really proved that anything is possible. He is the single biggest reason to why I love this sport.
No matter where you are from, everybody can celebrate this achievement.
This Argentinian team suffered one of the biggest upsets of all time and directly pulled themselves together, working harder than everybody else. They did it for their country and for their captain.
There was a small kid in Rosario with a dreamâ...
Now, Messi hasn't just won the World Cup, he has won football.",25,0
FIFA World Cup 2022,"Best final ever. One of, if not the best world cup ever.

You had the initial penalty converted by Messi. Then the classy counter attack. Then when France looked out of it, Mbappe shows up with  goals in a couple mins. In a world cup finals to see such a clutch double is impressive. 

Then in extra time, Messi beings it home. Then Mbappe answers.",0,22
FIFA World Cup 2022,Lol the Whistles fuck you infantino,1,3
FIFA World Cup 2022,LMAO MARTINEZ,1,27
FIFA World Cup 2022,Martinez,27,4
FIFA World Cup 2022,MARTINEZ LOL,27,1
FIFA World Cup 2022,Mbappe ... Golden Boot. He was magnifique! ,0,27
FIFA World Cup 2022,Martinez is certainly a character lmao,27,1
FIFA World Cup 2022,"Mbappe right now.

[https://i.imgur.com/NgnG.gif](https://i.imgur.com/NgnG.gif)

Cruel lmao.",27,1
FIFA World Cup 2022,"Lmao I love Rob Stone realizing he was gonna say something cringe but couldn't stop his sentence

""When she's that pretty you definitely...sneak in a kiss""",18,1
FIFA World Cup 2022,Mbappe looks so wounded.,25,9
FIFA World Cup 2022,"oh no, why dress him up?",7,10
FIFA World Cup 2022,What the hell is that lol,1,2
FIFA World Cup 2022,"So how bad do you want to butcher the trophy ceremony?

Qatar: Yes",7,27
FIFA World Cup 2022,"The greatest player we've ever seen puts in a MOTM performance in what is the best World Cup final ever seen, arguably the best World Cup ever in terms of on the pitch as well. 

He was already the GOAT but now maybe Argentina will love him as much as they love Maradona. 

On another note has any captain ever been less feared than Lloris? Look at the difference between keepers like Wojech, Martinez and Livakovic facing pens than him he had  fear factor",0,14
FIFA World Cup 2022,Did Macron just refuse to walk with Infantino? I would too.,27,4
FIFA World Cup 2022,These guys handing the trophy to Messi are so fucking cringe. Just let him do it y'all didn't do shit. Also that weird ass cape is stupid â....,3,2
FIFA World Cup 2022,uncleeeeeeeennnnnch ,27,13
FIFA World Cup 2022,macron you're not buddies with them stop,27,3
FIFA World Cup 2022,Why put that robe on him? Ruins every picture,7,27
FIFA World Cup 2022,This translator fucking SUCKS lmao,2,1
FIFA World Cup 2022,What a Legendary game. As a Brit I hate both teams equally yet it was the match of my life .,0,11
FIFA World Cup 2022,Argentinian president not coming because of a  jinx is great lore lol,0,1
FIFA World Cup 2022,Martinez what the fuck xD,2,27
FIFA World Cup 2022,Lmaoooo Martinez,1,27
FIFA World Cup 2022,Bruh,27,5
FIFA World Cup 2022,Did the boot trophy just break?,27,7
FIFA World Cup 2022,The trophy just got aroused,13,27
FIFA World Cup 2022,This is the most depressing medal ceremony ever,9,25
FIFA World Cup 2022,Mbappes like will you guys just leave me the fuck alone,2,3
FIFA World Cup 2022,"Lmao i am loving this weird macron cameo, real main character sundrome",18,1
FIFA World Cup 2022,Messi is now the King of Qatar,27,22
FIFA World Cup 2022,Argentina with the ballsiest pens I have seen at the end there. Emiliano Martinez was incredible,0,4
FIFA World Cup 2022,"Neil Maupay with his biggest career contribution, assisting messi",0,27
FIFA World Cup 2022,MESSI WON IM FUCKING CRYING,2,3
FIFA World Cup 2022,"What a finale, I'm absolutely gutted and heartbroken for France. A big congratulations to Argentina for the win at the end. I think Deschamps got the substitutions right, especially given how much of a nightmare scenario we started out with in the first half...this is sadly the best way it could have ended. Probably the best finale I've ever witnessed.

On another note, I feel like there should be a more serious discussion about pk shootouts, they feel like such a terrible way to decide a victor of a big international game like this. I'm not upset about how we lost, but they lead to these very hollow endings, it neither feels like a win or a loss for France, rather that playing a game of chance.

Anyways, Messi is now undisputed GOAT, no questions there. Mbappe with a worldie of a game himself assuming he gets the golden boot for the competition. I'm proud of France given how everything led up to this point and despite our setbacks I feel we really proved we were still not to be trifled with given our win back in .",25,22
FIFA World Cup 2022,"Commiserations to France, but this French team has as a few tournament wins left in them so French fans shouldn't bee too disheartened.

!flair :liverpool:",25,9
FIFA World Cup 2022,"Great refereeing for an insanely entertaining match. Dibu is frustratingly good at penalty shootouts lol.

I'm glad we have such a deep roster of good (young) players, France's future is bright.

GG Argentina",0,1
FIFA World Cup 2022,"All  WC finals goals for France by a  year old Mbappe's.        
       
Going to be really fun watching this man continue to develop and become the next GOAT",1,17
FIFA World Cup 2022,A shoutout to the ref today who was very consistent and fair,27,0
FIFA World Cup 2022,"Reffing was great this game, needs to be said since it rarely is",0,4
FIFA World Cup 2022,Lmfao Emi what a cunt,3,2
FIFA World Cup 2022,Martinez I'm dead ,25,16
FIFA World Cup 2022,Emi Martinez WTF lmfao,27,2
FIFA World Cup 2022,LMFAOOO MARTINEZ,1,27
FIFA World Cup 2022,Martinez LMAO,1,27
FIFA World Cup 2022,Feel so bad for mbappe man what a beast,25,9
FIFA World Cup 2022,Wtf Martinez ,27,0
FIFA World Cup 2022,"I feel bad for Mbappe,  goals and doesn't win, he's young and will be back. Today we celebrate a legend in Messi!",25,9
FIFA World Cup 2022,lol Messi sneaking in a kiss,1,27
FIFA World Cup 2022,mbappe is dead inside,27,25
