Match,text,Prediction_1,Prediction_2
Champions League 2024,"Honestly we didn't play THAT bad.

Guler is very young and raw, he needs to improve a lot, and while there weren't better choices, I don't think a player like him should start at Anfield. Brahim is just not a striker, what the fuck was Carlo thinking playing him striker?

Mbappe is just void of confidence. He's geniuenly mentally not there. I'm not saying this as a insult but it's clear on his face that he is more afraid of doing a mistake than he is happy if it turns out okay. That penalty was also just sad to see. Instead of bringing his confidence higher, it's now probably in the ground even more.

Asensio is more than fit to be a starter. If he doesn't actually start atleast like  more games this season then Carlo is just demented.",2,3
Champions League 2024,Oh man this sure makes me confident going into Sunday,20,4
Champions League 2024,Well what did we learn today kids.  Never simp for someone so hard.,7,27
Champions League 2024,"Should've put Mbappe on the left and Endrick as ST, that formation was shit",3,9
Champions League 2024,"Extremely disappointed in Mbappe today. I have defended him the whole season, and this was the night he had to show what he is capable of. Instead, he showed why he is not ready to be the leader of Real Madrid, let alone be the next Cristiano Ronaldo. As for the team's performance, expected, Liverpool played really well so congrats to them. This will be a long season for us, but if we manage to qualify for the next phase of the CL, it would be a miracle.",9,0
Champions League 2024,Conor Bradley/Caoimh√≠n joint MOTMs?,27,6
Champions League 2024,Madrid being our bogeyman team makes this all the more satisfying! UP THE REDS! ,0,4
Champions League 2024,Madrid should've never let Joselu leave. He was the key piece to the puzzle,27,22
Champions League 2024,Loll people feasting on mboopi,27,1
Champions League 2024,I thought less is more in RM case and they would look better with Mbappe and Jude running the show. Let's say Curtis and Conor had a different opinion,27,4
Champions League 2024,Sorry but Carlo need to go. He has been lost the entire season and its not able to find a solution.,25,9
Champions League 2024,Scoreline doesn't tell the story,27,0
Champions League 2024,Endrick doing his best to emulate Bobby Charlton by also balding,27,0
Champions League 2024,"Phase  Slot cooking Real, we actually may be winning the quadruple",27,20
Champions League 2024,Who says we can't do it,27,3
Champions League 2024,GET IN,27,3
Champions League 2024,Carlo's right eyebrow is in orbit somewhere near the ball from Ramos's penalty,27,3
Champions League 2024,Carlo Ancelotti welcome to the Arne Slot penitentiary,15,27
Champions League 2024,Glad to see mbappe finally have a good game.,17,0
Champions League 2024,that  hype was massive what a fall from grace by mbappe,27,0
Champions League 2024,Anyone got a clip of the Konate injury?,7,27
Champions League 2024,So does Realmadrid still have a chance to advance ?,7,27
Champions League 2024,Papa Flo is an Mbappe Tier  sub,27,4
Champions League 2024,"Jude just said ""It's humongous"" to the interviewer who's a woman, he immediately looked away for a sec",27,3
Champions League 2024,"If we win our next  games, then I will start to believe we can achieve at least  trophy this season. Especially our worst nightmare against Everton+Sean Dyche away.",20,22
Champions League 2024,"In hindsight, did anyone expect a different result for Real Madrid-Liverpool?


. Mbappe is the only dangerous attacker and he's been lackluster.


. Liverpool knows Mbappe is the only dangerous attacker, so they know Real Madrid will play on the counter. It is simple to double up on Mbappe.


. Liverpool has fast and strong centerbacks to neutralize Mbappe's pace.


. Liverpool knows Arda Guler is ineffective for a team like Madrid that plays on the counter. No one is afraid of Guler getting the ball in open space because he can't sprint.


. Liverpool midfield has too much physicality for an aged Modric and Guler.",27,14
Champions League 2024,"Bradley ate Mbappe. And as much as it pains me to say it, Liverpool look incredible.",0,9
Champions League 2024,that was really unnecessary from endrick at the end,27,10
Champions League 2024,Mbappe lol,1,27
Champions League 2024,Atalanta. Do you have something for us?,7,27
Champions League 2024,My friend is at the stadium and he told me just saw Mbappe starting Arabic on Duolingo,27,4
Champions League 2024,The good winning against the evil,20,7
Champions League 2024,"Also: I'm still not sold on this format and they'll almost certainly progress, but everyone who truly loves this game should be able to enjoy Madrid in th and PSG in th.",27,17
Champions League 2024,"I genuinely don't think we are going to win anything this season, outside of having the ability to do it, the entire team needs to actually want to win. Kylian-fucking-Mbappe will play most min of the season when he clearly doesn't want to even play football anymore, let alone win in it.

Contest a loose ball? Not my problem.
I lose possession? Not my problem.
Should I help in defend? Not my problem. 
A teammate makes a good run forward? It ain't me so why pass?

Don't get me wrong, Mbappe is one of the most talented players I've seen but I have watched/played football for many years, thousands of hours, and I cannot remember a worse professional player in my life. For the simple fact, that, he doesn't want to play football.

EDIT: Like anybody that has played football as a teenager has seen this player, the kids that don't want to play but their parents forced them to. No amount of talent can compensate the simple fact that if you don't want to do it, you won't.",10,9
Champions League 2024,Sucks Madrid didn't have vini and they had no one to fill in at LW,27,3
Champions League 2024,Liverpool remains perfect  of  against d uninspired Real Madrid...,27,0
Champions League 2024,"Where were you when real madrid was die?

I was at home watching the match when uncle benetiz called.


Real is kil.

Yes",27,7
Champions League 2024,"The way Salah missed that pen and laughed afterwards shows what utter class he is. Modern day Voltaire. Madrid were bare fucked after that. And the fans chanting his name afterwards is Liverpool to a T. YNWA.

Even if he goes at the end of the season he's right up there with other talismans like Gerrard, Carragher, Reina, Alonso and Suarez. I haven't had as much fun watching this team since Fowler did his celebration sniff sniff

P.s. offload Allison pronto to the Saudi's and reinvest the money in another central defender for when Virgil pops his clogs. Kelleher gonna be next Evil Martinez except homegrown for CL.

P.p.s I've always found it hilarious to compare the atmosphere at Anfield to the Etihad. What a stain of a club. We all complained about utd in the s but at least their core was academy graduates and they had some cool Scandanavians. Then again it's alright, most of you lot that support city have never been to Manchester anyway. And TBF who could blame you. Shit hole.",1,3
Champions League 2024,Endrick is also a dirty rat bastard. Hopefully his career turns out like that Reinier guy,20,2
Champions League 2024,"If he's going to be shit and he's going to be a starter no matter what at least he could try to act like he cares and pretend to press a little. Even freaking Hazard put more effort.

Anyway, I really really liked Gravenberch.",0,4
Champions League 2024,i told every madrid fan i know mbappe was gonna be a flop,27,9
Champions League 2024,Didn't expect Mbapp to be a net negative in the year ,27,26
Champions League 2024,"Missing: Kylian Mbappe

Last seen in the vicinity of L.",27,25
Champions League 2024,Endrick I'm just not seeing it. He'll be at Sunderland soon,27,7
Champions League 2024,"Well we can't all sign a generational striker and have him fit perfectly into our system 

(pls ignore season /).",10,27
Champions League 2024,"Mbappe woke up and felt dangerous lmao 

A shame being right about him at the cost of the club performances.

Perez showed once again, that squad planning isn't his strong suit. Destroyed a balanced team for another galactico",10,3
Champions League 2024,Mbappe is officially finished,4,27
Champions League 2024,No tactics necessary,27,10
Champions League 2024,How was Real so shit? And Mbappe missed a penalty?,7,3
Champions League 2024,Back to back wins against Madrid & City must be a confidence booster,20,4
Champions League 2024,Revenge ,27,2
Champions League 2024,After Mbappes penalty it looked like we didn't even try anymore,9,10
Champions League 2024,"Madrid were out of ideas after the first second.

No invention, nor creativity.",27,9
Champions League 2024,Losing in front of Nadal is nasty,11,3
Champions League 2024,I'M FUCKING BUZZING RIGHT NOW.,2,21
Champions League 2024,Damn Mbappe this was your chancd,3,2
Champions League 2024,"I've lost my voice. It's worth it, though, just leaving the game now. How bad does Konate look? Endrick is a little cunt.",7,9
Champions League 2024,quadrable in play for liverpool,27,10
Champions League 2024,Send Mbappe back to PSG,27,4
Champions League 2024,Mbappe is so shit. Real needs a Joselu type in January.,3,27
Champions League 2024,"Another ‚Äúfantastic"" Ballon d'or submission that Mbapp was talking about to play exclusively ",27,4
Champions League 2024,I thought without vinicius mbappe would shine but Holy shit this guy dropped a genuine / performance,9,27
Champions League 2024,Generational stinker from Mbapp tonight.,27,4
Champions League 2024,Any update on Konate?!,7,27
Champions League 2024,"when i said in late september that aside from big names, real madrid is going to have a huge problem with clashing personalities i was called overreactive and that they would gel in no time. modric threw his hands up after every unsuccessful pass, bellingham's gimmick is looking frustrated when anyone else makes a mistake, guler going for  hero goals that go wayyy out and mbappe who constantly looks like he has suffered a miniscule stroke. they don't play like a team. at all.",2,3
Champions League 2024,"We're going to get a press conference with bellingham crying and moaning about being a scapegoat and how it saddens him.
Vini and Florentino crying for a stupid award and blaming the whole world for it. 
Mbappe and Ancelotti with his bullshit excuses. 

That is why I never feel sorry no fucking player or when  their egos are hurt. boo them all you want, call them out when they play like shit they get paid millions anyways. Bunch of giant man babies with fragile egos that want the world to kiss their feet.",25,2
Champions League 2024,Great result in a great season so far. Really happy with how everything is going. Ps if you want a laugh go and take a gander at r/Gunners,0,17
Champions League 2024,"endrick offered absolutely nothing except trying to injure Ibou, weird little creature",3,11
Champions League 2024,Lack of a striker next to Mbapple is causing so many issues lol. Turtle will come back though,1,27
Champions League 2024,"Real Madrid fans I'm not here to make fun of you, just here to say I'm starting to feel bad for you",25,9
Champions League 2024,"Mbappe looked poor. Madrid looked lifeless.

Liverpool look like the best team in Europe by far.",9,0
Champions League 2024,"Mbappe battered by another argentinian player, bros gunna have nightmares.",27,25
Champions League 2024,"I think our team is still bad we haven't played any big games and are scarping by everyone /s

Idc how hindsight it is Macca Szobo Grav and Endo was much better than spending + on Bellingham. Holy fuck did Macca run that game and our  CBS are just massive.",9,19
Champions League 2024,Madrid what a team ,27,4
Champions League 2024,Mbappe is incredibly bad.,11,9
Champions League 2024,"Finally, we broke the curse, we owe it to Vazquez's dive.",23,15
Champions League 2024,Bizarre Mbappe performance I have to say. Form is one thing but he was weak and completely not with it. Is he carrying an injury? Genuinely looked like his fitness wasn't there.,7,26
Champions League 2024,Mpoopi ,27,25
Champions League 2024,"i mean arda and brahim had a pretty bad game too but if mbappe's name was anything but mbappe he would've come out instead of arda. he did every thing wrong today, shit performance all around",9,27
Champions League 2024,"When are we going to get mendy, courtois call out mbappe for being so shit and give us a ‚Äúon my momma he is playing against us"". 

Esa mierda tiene que ir al castilla truly a liability having him on the field he is so bad the rest of the team won't pass the ball because he won't do shit with or worst lose the ball and being the diva he is he won't track back. 

Was a cancer at psg, currently a cancer with the national team and by how things are going to far things are not going to be good for him here.",9,27
Champions League 2024,Maybe Madrid needs another Winger guys,27,20
Champions League 2024,"Why is every single one of madrid's players a dirty prick (except camavinga)

Hope bradley and konate are ok",3,27
Champions League 2024,"Endrick finishing the game with a dirtier kit in  min than Mbappe in  min is exactly what is wrong with Mbappe, have not seen him do the extra step or run the extra mile for the badge this entire season, always standing around waiting for a pass to take a  on  with the defender (and fail without exception) was his entire game today",22,9
Champions League 2024,Get absolutely fucked Madrid,2,27
Champions League 2024,"What a win for Liverpool. Lost their keeper, lost their best attacker, lost the best RB in works football and still beat RM minus Vini. Fair play to Liverpool.",4,0
Champions League 2024,"Mbappe to now focus on the National Team, lol",1,17
Champions League 2024,Don Carlo? Don Arne,27,7
Champions League 2024,"Being honest, I genuinely expected the turtle to perform in his preferred position.",27,4
Champions League 2024,"Fair play to Asencio, looked good for his second start",0,4
Champions League 2024,"He was shit but there's some headloss with Mbappe ‚Äòwhy's he not coming off?' Like it was clear Ancelotti wanted to look to hit us on the break and the best chance of that is with gambling on him.

Jones has took a step again this season. Injuries really held him back as he's always had it in him to be a really solid midfielder for us. He's had that confidence from the start.

Also Madrid being where they are in a super league lite is very funny considering Perez is begging for the real one still.",1,0
Champions League 2024,I presume real will be doubling down their efforts to sign liverpools best rb in jan (connor bradley).,27,3
Champions League 2024,Completely deserved win from Liverpool. Real Madrid should consider themselves lucky it wasn't by  or ,22,27
Champions League 2024,Trouble in a paradise there neighbour?,7,20
Champions League 2024,Embarrassing asf,12,27
Champions League 2024,Good for Liverpool.,0,4
Champions League 2024,A beautiful day!!,17,5
Champions League 2024,"At this point, we need to start Endrick ASAP, I feel like Mbapp is the next Hazard",4,22
Champions League 2024,"Who doesn't love seeing Madrid humbled. 

Schadenfreude",27,3
Champions League 2024,Vinicius getting injured so the world can see how shite Mbappe is regardless of position is reason enough to give him the Ballon D'or. I.Q off the charts.,3,27
Champions League 2024,"good to see big teams getting humbled, bye felicia",15,13
Champions League 2024,Another Mbarrassing performance,12,27
Champions League 2024,Na Mbappe must be a double agent or something. Completely destroying Madrid from the inside lmao,1,27
Champions League 2024,fuck was endricks problem went for Konate three times,2,27
Champions League 2024,Endrick swore to fuck Konat,2,3
Champions League 2024,mbappe legit looking washed,27,4
Champions League 2024,I know the discourse around arda has become toxic somewhat but it is crazy that he was the first to go in this game. He made some glaring mistakes in passing was despite that he was one of the better players on madrid's side. modric mbappe and bellingham should have been taken out way before he was,27,22
Champions League 2024,Expected more from Madrid.,27,8
Champions League 2024,Bellinghams PR needs to work overtime,27,3
Champions League 2024,I will never get tired of watching Real lose,9,27
Champions League 2024,"Dog walked Real Madrid could have been .. Never known anyone to cry about injuries like Real Madrid and Arsenal fans. We all have injuries, the rest of us crack on with it. We look unstoppable at the moment, yet we keep getting told ‚Äòyour big test is your next game'. Kelleher out here casually smashing football like it's nothing. LOVE IT arneeeeee slotttttttttt",18,1
Champions League 2024,Just seen Bellinghams interview after the game. He comes of as very mature. Easy to forget he's  only. Really like him,22,27
Champions League 2024,"Bellingham is soo overrated.

I only say that because I keep hearing how he is a generational player, will be a Madrid great etc..I just don't see it.

He is a moments player and I stand by that. He will come up with an goal or an assist like in the Euro's but he doesn't dominate a game from start to finish imo, which is what generational players do. Look at how Iniesta used to control and dominate games. 

I actually think Camavinga was far better and more influential before he went off with an injury.",0,22
Champions League 2024,"Real needs some serious rebuild, the youngsters are not that great, the stars are failing expectations too often. Not sure why Trent would even consider playing there",6,10
Champions League 2024,Seeing so many parallels between Messi's first season at PSG and Mbapp's first at Real Madrid.,27,22
Champions League 2024,It's been  years since mbappe peaked. He is not that guy anymore. The next hazard is here.,27,3
Champions League 2024,"How did Salah miss the pen and Diaz not score in the end ? Could have been a -, the Madrid usual.",7,6
Champions League 2024,Hope they keep this form throughout La Liga ,20,8
Champions League 2024,Still waiting for the Madrid black magic,20,27
Champions League 2024,"Rudiger-Asencio duo already looks more convincing than Rudiger-Militao, only positive from the night really",0,4
Champions League 2024,I miss Benz genuinely,25,27
Champions League 2024,"Mbappe, o I am laffin",27,22
Champions League 2024,"People will talk about Mbappe, but Fede Valverde was absolutely inexistent tonight. I was shocked to see him loitering around the midfield at the th minute, and I suddenly remembered that he was playing.",26,22
Champions League 2024,"Well, their luck had to run out at some point. If was good seeing you, ""Real"", now fuck off to whatever else you've got going besides football. Fascism still a thing?",2,7
Champions League 2024,th place were still in it obviously,27,4
Champions League 2024,WE ARE THEM. End of story.,27,6
Champions League 2024,Carlo is gonna get sacked and Zidane is coming back isn't he.,27,3
Champions League 2024,Pump this directly into my veins.,27,3
Champions League 2024,"Doesn't look good for Konat, still down on the pitch.",10,27
Champions League 2024,So how many points do you need for top ?,7,27
Champions League 2024,Madrid look so different in the cl compared to last season.,27,22
Champions League 2024,"We were well over due for that win, get in",21,23
Champions League 2024,Great game,0,15
Champions League 2024,dont watch much of camavinga but God damn wat a player he is. In the few games i watched him play he always turns up,9,3
Champions League 2024,"Mbappe needs to fuck off, he's absolutely shite",2,3
Champions League 2024,Liverpool best team on earth? Many people are saying it.,7,6
Champions League 2024,Fraudbappe,27,7
Champions League 2024,Can't believe they chose this fraudulent pizza-loving turtle over Harry Kane.,27,26
Champions League 2024,Liverpool Barca clash gonna be legendary,0,4
Champions League 2024,Mbapp dribble like he has a dick up his ass.,27,3
Champions League 2024,MAN I LOVE IRELAND,18,22
Champions League 2024,"Mbapp is shit, Arda had bad night, and diaz couldn't release a ball to save his life",27,2
Champions League 2024,This mbappe is a  trick pony fr,27,3
Champions League 2024,Does Alisson save that penalty?,7,27
Champions League 2024,I know this will get thrown out of propostion but we did really good with  men and a lot of our key players missing.,0,4
Champions League 2024,"People talking about Man City without Rodri

Well this is us without Vini Jr ",27,22
Champions League 2024,I can't believe this is my life,26,27
Champions League 2024,The one time Man City is shit Liverpool takes the reins Us Arsenal fans can't catch a break,27,9
Champions League 2024,"Highlight of the night was Asencio having enough of Nunez early first half lol, other than that nothing noteworthy happened in my book",1,22
Champions League 2024,can they sack Ancelotti already? madrid looked like everton out there tonight,7,27
Champions League 2024,"No offense to Liverpool they were fantastic today but honestly without Vini plus our already awful season, it seems like we will get destroyed by any decent team",3,0
Champions League 2024,"Can't belive mo missed a pen


Liverpool fans just to be sure, you still want him to renew right?",7,27
Champions League 2024,Successful hate watch,0,20
Champions League 2024,Two Irish lads ending Mbappes career,27,25
Champions League 2024,Liverpool should put a bid in for Kylian,27,4
Champions League 2024,mbappe is washed and should come to MLS. he should come to philadelphia union and become a Chester legend,27,8
Champions League 2024,So uh Arteta fans still saying he's better than Slot?,7,6
Champions League 2024,salah was horrible ngl,14,11
Champions League 2024,Ancelotti is one of the most overrated managers of all time.,3,0
Champions League 2024,"Annoying that Liverpool get to play Arsenal, City, and Madrid amidst an injury crisis

Edit: lmao this struck a nerve",1,3
Champions League 2024, win against Madrid after years of spankings and these guys are acting like UCL winners,3,27
Champions League 2024,"I wasn't really too impressed with Liverpools performance, Real played with a extremely weak . Feel like the midfield is very lacking for Liverpool.",9,10
Champions League 2024,Take Bellingham his goals away and he's not even half the player Gravenberch is.,27,22
Champions League 2024,"Good guy Killian, uniting Ireland",0,4
Champions League 2024,"all this talk about if bradley can handle mbappe

we should've been wondering if mbappe can handle bradley!",26,7
Champions League 2024,"Can't handle the Irish, both northern or republican",27,10
Champions League 2024,Scared of the Irish apparently,14,27
Champions League 2024,Tbf they're both quietly underrated,3,10
Champions League 2024,I think he's some player who used to play in a non-top  league. Understandable he gets dominated by better players,27,0
Champions League 2024,"But he runs really fast, though.",27,0
Champions League 2024,"Transferred in the morning, transferred in the morning. He's getting transferred in the morning, Kylian Mbappe.",27,3
Champions League 2024,We haven't forgotten Henry.,27,25
Champions League 2024,he did beat bradley with some sharp dribbling a couple times,27,3
Champions League 2024,,27,10
Champions League 2024,And both of our RBs were free.,27,4
Champions League 2024,I actually hate him. He's so fucking good,2,0
Champions League 2024, final PTSD,27,3
Champions League 2024,"Courtois is the real GOAT from Real Madrid IMO, dude has saved their ass over and over and over for years, so many games they should have lost but he carried hard to keep them alive somehow.",27,0
Champions League 2024,Bro is always on a mission against us,27,3
Champions League 2024,Same as always. He won them the  CL final. Feels good to see them finally crumble.,17,4
Champions League 2024,"He is still the best keeper in the World thanks God because it would have been ugly (well even more) , also Kelleher is as good as i heard, kinda a rich man problems for Liverpool in the future",15,0
Champions League 2024,"Yeah, it should've been  at least",4,27
Champions League 2024,Conor Bradley had him pocketed no problem.,27,0
Champions League 2024,Bro hasn't been the same since the World Cup final in Qatar,22,27
Champions League 2024,"He is the best paid player and has star statut but if it was meritocracy based he should see the bench a game or two, also why is his first touch so BAD ? like even Lukaku can get some of those passes",7,6
Champions League 2024,"I know the words, but the way you use them has me reaching for Google translate.",27,22
Champions League 2024,He can't even complete a simple pass properly.,27,10
Champions League 2024,"And Guler as well. Allow me to hijack this comment
thread so I can address how people don't actually watch Guler but Madrid PR convinced everyone he is already √ñzil. Talented, sure, but still very raw. Hope we can see a decrease in the ""better than Yamal"" shouts from Madrid fans now.",20,27
Champions League 2024,You are being generous with the ,27,17
Champions League 2024,"United fans, is this what it feels like to have Rashford?",7,27
Champions League 2024,Ligue  is a bigger joke than we thought if Fraudappe looked like a GOAT contender over there.,1,10
Champions League 2024,"He looked good the last - minutes. 

Which is fair. Real Madrid ain't paying for peak Mboopi like PSG was, so they get what they're paying for.",4,0
Champions League 2024,Interesting to see what l'equipe give him,7,0
Champions League 2024,I'll never forgive Real if they ruin him,27,10
Champions League 2024,Easily the worst game I've ever seen him have.  Hard to believe it's the same guy that carried France to a WC final,26,3
Champions League 2024,He was surprisingly quick for a guy who had Mbappe in his pocket,26,22
Champions League 2024,He's the right sided Andy Robertson,27,4
