Match,text,Prediction_1,Prediction_2
FIFA World Cup 2022,That Messi penalty at the end was so filthy it needs to be on Pornhub,3,27
FIFA World Cup 2022,"Now we can talk about Messi being the greatest player of all time. Well done Argentina, well done France. Phenomenal.",0,4
FIFA World Cup 2022,This is the best sports match that ever exist in the entire history of sports. Imagine not liking football.,0,9
FIFA World Cup 2022,Best finals ever,0,13
FIFA World Cup 2022,Messi I'm in tears,25,16
FIFA World Cup 2022,"Messi is the greatest to ever play football. No doubt about it. Congrats Argentina. and what a final, absolutely crazy",0,13
FIFA World Cup 2022,Messi is the goat,27,4
FIFA World Cup 2022,"What a game! What a WC Final! This will go down in history. Congrats to Argentina, and Messi of course!",13,0
FIFA World Cup 2022,"The greatest final of my life ,The goat debate is over ! Messi ",23,21
FIFA World Cup 2022,"Just happy for Messi, especially after that performance",17,5
FIFA World Cup 2022,Does this mean Saudi Arabia is a world class team now?,7,6
FIFA World Cup 2022,Mbappe deserves the golden ball IMO,0,27
FIFA World Cup 2022,[deleted],27,4
FIFA World Cup 2022,"Messi: ""Today, I feel myself""",27,4
FIFA World Cup 2022,Must piss you to score four in a final and lose,9,3
FIFA World Cup 2022,This is destiny,27,13
FIFA World Cup 2022,Topless chick in Qatar?,7,27
FIFA World Cup 2022,"Congrats Argentina and Messi.

Mbappe's ridiculous.",13,15
FIFA World Cup 2022,Messi achievement unlocked: MARADONA,27,26
FIFA World Cup 2022,BEST WORLD CUP IN HISTORY,4,27
FIFA World Cup 2022,I don't care what Reddit says. Best world cup in decades,0,4
FIFA World Cup 2022,What a beautiful game,0,4
FIFA World Cup 2022,This was the greatest match I've ever seen in any sport.,0,26
FIFA World Cup 2022,"The greatest World Cup final, EVER.",0,21
FIFA World Cup 2022,Greatest World Cup final of all time.,0,13
FIFA World Cup 2022,Great booking. I was sports entertained.,0,13
FIFA World Cup 2022,"Geeeeeeeeeee geeeeeeeeeeeeeeeee

Congrats to Argentina! I'm honestly really happy for Messi ",17,13
FIFA World Cup 2022,Putting the ball in the back of the net  times in a world cup final and losing must be a mind fuck.,3,2
FIFA World Cup 2022,Someone get Mbappe a chiropractor,27,8
FIFA World Cup 2022,GGWP. What a game.,0,13
FIFA World Cup 2022,Emi Martinez won Argentina that World Cup,21,4
FIFA World Cup 2022,The may have been the best possible game for the Messi vs Mbappe's narrative possible,0,4
FIFA World Cup 2022,Griezmann and Giroud would have been very helpful in the shoot out,4,20
FIFA World Cup 2022,"Di Maria masterclass. Most underrated player of the last decade. If it wasn't for his time spent in PSG and Man U stint, he would be seen as one of the greatest wingers of all time.",0,9
FIFA World Cup 2022,Andres Cantor is crying. Awww,25,17
FIFA World Cup 2022,"First Kane, now Lloris. Spurs as usual.",27,4
FIFA World Cup 2022,France should have been cunts in that penalty shootout. Really worked for Argentina,22,27
FIFA World Cup 2022,"I'm French and obviously fucking sad but this was such a shitty final for  mins or so, then this became an absolutely incredible game. GG Argentina, they deserve it. Mbappe's will have more chances at the trophy !",0,25
FIFA World Cup 2022,"Holy fucking shit what a match, wish I had time to let it sink in. Now I have go to work lol",1,0
FIFA World Cup 2022,ANKARA MESSI,27,2
FIFA World Cup 2022,Wonder if it ever happened before that a team got  penalties in a single world cup,26,27
FIFA World Cup 2022,"why does everything seem so casual afterwards, the fans aren't even going that crazy

the reactions by the players and fans just seem muted or something",6,27
FIFA World Cup 2022,Lloris wanted non of the smoke in that shootout the man was shook,27,26
FIFA World Cup 2022,As a football fan for the last  mins I just want to say I am exhausted,9,25
FIFA World Cup 2022,Jesus Christ y'all. Somebody bum me a cigarette,3,12
FIFA World Cup 2022,Messi will be MOTM but it should be Martinez,27,20
FIFA World Cup 2022,Hopefully Macron brought his grief photographers with him,20,27
FIFA World Cup 2022,"Glad France didn't get the Back to back with this squad.

It's a good squad, but if they got back to back it would go down as one of the best of all time, which it's very far from.",0,15
FIFA World Cup 2022,"Quite possibly the best World Cup final ever played, easily the best of the past - years. I don't know what to say other than ""I was here.""",22,6
FIFA World Cup 2022,Everyone priasing Mbappe but France were nothing without Otamendi,27,22
FIFA World Cup 2022,"If Maradona was alive to see this, he wouldn't be anymore.",27,22
FIFA World Cup 2022,I was here ,27,4
FIFA World Cup 2022,this was  minutes of nothing and + minutes of fucking insanity,3,2
FIFA World Cup 2022,"Best fucking final of all time, my heart",2,0
FIFA World Cup 2022,Stressful would a misunderstandment to describe this final.,6,20
FIFA World Cup 2022,th Ballon D'Or sealed?,27,7
FIFA World Cup 2022,GOAT.,27,2
FIFA World Cup 2022,ADMIT MESSI IS THE GOAT NOW SHAKA HISLOP,2,3
FIFA World Cup 2022,Crazy how similar this was to the MLS Cup Final.,26,7
FIFA World Cup 2022,"By far the best World Cup final ever, just a shame it had to end.",9,0
FIFA World Cup 2022,Football wins today,27,4
FIFA World Cup 2022,That's was the craziest game ever,13,17
FIFA World Cup 2022,GOAT debate settled?,27,7
FIFA World Cup 2022,Best World Cup final ever,0,13
FIFA World Cup 2022,"Takeaways from this match:

) Mbappe is a god.

) Aside from Lloris, the rest of France did absolutely not deserve to win.

) Montiel was an idiot (for that handball). Also Montiel was your savior (scoring that last PK).

) Messi is the goatiest goat that ever goated.",27,0
FIFA World Cup 2022,Good job everyone with the anulo mufas,0,4
FIFA World Cup 2022,go on Di Maria!,27,3
FIFA World Cup 2022,Congratulations to Argentina!,21,13
FIFA World Cup 2022,What a game. Argentina had France on the ropes until the brain fart from Otamendi.,0,13
FIFA World Cup 2022,"Man. Games like this are why you watch. 

What a game.",22,26
FIFA World Cup 2022,Aguero's gone full kit wanker mode,27,0
FIFA World Cup 2022,Tottenham and penalties are cursed duo this year,3,27
FIFA World Cup 2022,Should've let Mbappe shoot all five penalties,27,8
FIFA World Cup 2022,Messi not even crying,27,9
FIFA World Cup 2022,Love you Emi,18,0
FIFA World Cup 2022,What a legendary game! The stress levels in the last  minutes were unbearable,0,25
FIFA World Cup 2022,HES DONE ITTTT,27,2
FIFA World Cup 2022,MESSI ON A MILLION BACKS,27,2
FIFA World Cup 2022,"Messi cemented himself as the GOAT, and Mbappe as one of the best of all time too. Amazing game",0,4
FIFA World Cup 2022,Holy shit in crying! He finally did it!!!!!!!!!!!,25,26
FIFA World Cup 2022,I wish that match never ended,8,20
FIFA World Cup 2022,Martinez won Argentina this World Cup by saving that Kuol shot in the round of  against us,21,4
FIFA World Cup 2022,Put $ on Argentina to win it all. Using it to buy a burger later. Los meseros Argentinos me alimentan una ves mas.,27,7
FIFA World Cup 2022,"Argentina tried their hardest but in the end, they still won.",4,22
FIFA World Cup 2022,I hope Argentinians like Budweiser!,20,8
FIFA World Cup 2022,What kinda horseshit commentary is that?? Even though he came off his line a few times,7,6
FIFA World Cup 2022,Quite possibly the greatest match ever played,0,27
FIFA World Cup 2022,"congratulation messi, congratulation argentina",15,13
FIFA World Cup 2022,Wow this Messi winning script is really good. The guy who wrote it should get a promotion.,0,4
FIFA World Cup 2022,F for CR,27,3
FIFA World Cup 2022,IM SO FUCKING HAPPY FOR MESSI OH MY GOD,0,21
UEFA European Championship 2024,With Reddit down Southgate had no idea who to sub on.,6,27
UEFA European Championship 2024,"England created less xG at Euro  (.) than Croatia (.).  
  
Croatia went out at the Group Stage.",27,22
UEFA European Championship 2024,Kane is never winning shit.,27,10
UEFA European Championship 2024,Palmer and Watkins showed way too much in the  minutes between them they've been allowed to play so far in the tournament to be sat on the sidelines watching / minutes of nothing before coming on.,27,4
UEFA European Championship 2024,"At the of the day, just making it to the final was an achievement given the circumstances (no Kalvin Phillips)",22,23
UEFA European Championship 2024,"If there was a rematch, Southgate still wouldnt start Palmer",27,10
UEFA European Championship 2024,"Yamal will probably get most of the glory, but for me olmo was the most significant Spaniard in the squad. Pedro's injury was pivotal for Spain's victory",22,0
UEFA European Championship 2024,"A victory for attacking football, says Lineker. 

Nice final dig at Southgate.",0,4
UEFA European Championship 2024,"Congrats to Spain, the best team in the tournament by some distance. Yamal, Olmo and Williams brilliant. Morata not prolific but with great movement and pressing, leading the line like a proper striker(take notes Kane). Rodri and Ruiz best midfield in the tournament. Cucurella shitting all over Gary Neville's opinion etc.

Foden and Kane, absolutely no impact whatsoever the whole tournament. Southgate, anyone with eyes could see Kane and Foden were doing nothing the whole tournament.

Feel for Watkins and Toney, they must've been watching every single game thinking ""if I was on the pitch I would've at least run in behind a couple times"". Kane looked like he was injured every game, and Foden was just ineffective completely.",0,15
UEFA European Championship 2024,"The clear best team of the euro won it, very very deserved

Still not convinced that Southgate is the right coach for this great group but no shame in losing to this exciting Spain really",0,9
UEFA European Championship 2024,"Wow,  wins out of .

Tough group against Italy and Croatia.

Having Germany in the quarters, and then France in the semis, both matches worthy of a final against sides which are more than capable of being there.

Was really skeptical and negative when the decision to fire Lucho and hire De La Fuente was announced. But the latter proved me and other doubters wrong.",26,22
UEFA European Championship 2024,Basically fluked our way to the final with at best one good performance in the whole tournament. Really can't argue with the result - Spain well deserved winners.,0,22
UEFA European Championship 2024,"And in the end, the best team of the tournament won. Spain played the best football, Spain played the most beautiful and exciting football. In the end Football won.",0,4
UEFA European Championship 2024,"Only time I saw Foden and Kane was when the camera picked them out after the final whistle.

Probably England's worst players of the tournament by far.",27,22
UEFA European Championship 2024,"Cole Palmer was Top  player in this England team and never once started.

That should get Southgate sacked alone.",27,9
UEFA European Championship 2024,Reddit has a market cap of  Billion dollars and still buckles when there's a big thread going on.,27,3
UEFA European Championship 2024, consecutive goals Walker has been responsible for. How he fails to get criticism is ridiculous.,3,27
UEFA European Championship 2024,England played reactive football throughout the tournament and finally paid the price for it.,4,27
UEFA European Championship 2024,Shoutout to Real Sociedad. Five of their players really made the national team.,27,1
UEFA European Championship 2024,"Walker not tracking for both goals, but I'm not seeing a lot of criticism.",10,27
UEFA European Championship 2024,"Gary Neville said after the England vs. Denmark game, ""Gareth has to change something or we all know how this ends"". We all knew he was right.",4,22
UEFA European Championship 2024,"Seriously can't get over how Southgate looks at Kane's performance throughout the tournament and thinks, yup he's starting the next match. It's not like he doesn't have great options on the bench.",10,22
UEFA European Championship 2024,BBC Post match analysis is summing it up for England. They have a lineup filled with incredible attacking minded players being managed by a defensive manager. Southgate's tactics managed to completely nullify some of the best attacking talent England have had for years.,27,0
UEFA European Championship 2024,"If you beat Italy, Croatia, Germany, France and England. You kinda deserve it.",4,0
UEFA European Championship 2024,"They deserved it. In this dull ass tournament they've been a treat to watch the whole way through. 

Lovely direct football, Williams and Yamal showing up on the world's stage. While the rest of the tournament was trying to put us to fucking sleep",3,9
UEFA European Championship 2024,"Southgate's attacking setup is hilarious, the actual performers are always on the bench

Also, congratulations to England's ""best natural talent"" for a proper  tournament. The fact that neither Palmer nor Gordon started a match is criminal",0,1
UEFA European Championship 2024,"That went from a fairly unremarkable st half where neither team honestly generated all that great of a clean chance to an UNBELIEVABLE nd half. Spain finally broke through. England looked dead in the water for the next min until Palmer hit a screamer. The final min were excellent. Unreal ball for Cucuarella to hit Oyarzabal and somehow, someway, England had a chance to pull off the impossible AGAIN on that corner late but Simon/Olmo stood tall. 

Best team throughout the whole of the tournament won. Nico/Yamal is a hell of an attacking duo to have for the next decade.",0,9
UEFA European Championship 2024,Please fire southgate,27,3
UEFA European Championship 2024,"Stats: No single team has reached the finals twice in a row without winning the second time.

Harry Kane: ""Hold my room-temperature pint of lager.""",27,3
UEFA European Championship 2024,"England players have the look of ""if only we actually went for it"". Its that look of absolute regret of at least not going out fighting. This type of anti football is only for results but gives you no joy to play that way. 

This is Southgate's ultimate flaw. He is obviously very good at playing pragmatic football, but ultimately, to win, you need to go out there and go for it, not just hope to squeeze it over the line.",0,24
UEFA European Championship 2024,"I feel like Southgate subbing Kane off after  minutes both in the semis and the final means he knows deep down that Kane is unfit and having a terrible tournament, but Southgate prob felt that not having Kane in the starting lineup would also be demoralising for everybody else in the team.",27,3
UEFA European Championship 2024,"Well-deserved win for the best team in the tournament who played the best football and faced the toughest opponents en route to the final.

Clutch moments and late drama overshadowed the clear systemic and tactical issue under Southgate that everyone has known for ages. 

His subs in previous rounds bailed him out through individual brilliance, and whilst he absolutely deserves praise for changing the culture and atmosphere in England, as well as things like penalties etc, he was never good enough to lead England to a trophy which people will agree they deserved.

Guess we'll see what the FA will do now.",0,22
UEFA European Championship 2024,"Kyle Walker may not be the fastest, or the strongest, or the most skillful, or the hardest worker, or the most consistent, or the best father, or the best husband",0,27
UEFA European Championship 2024,"wasn't expecting the ref to whistle off at exactly  minutes.

congratulations to Spain, best team this entire tournament.",15,0
UEFA European Championship 2024,This is gonna ruin the tour,3,9
UEFA European Championship 2024,"Fermin Lopez, Lamine Yamal and Nico Williams posing together with the trophy, he's off to Barca fellas",27,3
UEFA European Championship 2024,"> ""The great fallacy is that the game is first and last about winning. It is nothing of the kind. The game is about glory, it is about doing things in style and with a flourish, about going out and beating the other lot, not waiting for them to die of boredom.""

So congrats to Spain, they did that. Meanwhile Southgate is still regretting that he didn't put another defender on after we got it back to -.",24,15
UEFA European Championship 2024,best game of the tourney germany spain IMO. Too bad it was the qf,0,9
UEFA European Championship 2024,"That was a tough watch as an England fan.  Spain certainly deserved the win not only in this match but for the whole tournament. Would be interesting to see how much better they would be with a capable striker. 

For England, we almost secured yet another sucker-punch but felt Southgate played all his aces in getting the equaliser.  I felt all the players played okay but were just generally outclassed (aside from Kane).  Shout out to Shaw who I think dealt with the threat of Yamal admirably considering the amount of football he has played.  We have a young team with loads of potential - would be great to see what a more forward thinking manager could do with them. 

I also hate the British football media as much as anyone else.  Please don't judge us based on what they say!",0,3
UEFA European Championship 2024,Comments suggesting Foden has been dire for England getting removed. Top quality moderation.,27,3
UEFA European Championship 2024,"If Trent and Walker were Spanish, Trent would % play every game over him. No doubt in my mind. 

Southgate is simply too ""risk"" averse and would rather play it ""safe"" no matter what.",27,4
UEFA European Championship 2024,"Spain beat Italy, Germany, France and England to win the Euros. Can't say they didn't deserve it. Certainly ran the gauntlet. 

Can't help but feel this is the last tournament Kane is the lead, this is the kids team now.",27,22
UEFA European Championship 2024,Imagine not playing Trent because of defense and your starting RB gives up both goals,27,3
UEFA European Championship 2024,"It's hard to ridicule a manager who made a final, but Southgate's tactics just aren't right for a side like England. Kane looked useless and it's not from poor play but because sitting back on the counter is one of the few things Kane isn't great at. And when they did have the ball they weren't crossing it into him. Any manager who can make Kane look useless needs to be questioned. It's one thing to have a preferred tactic, it's another to force it at the detriment of your world class striker.",27,3
UEFA European Championship 2024,They really need to make a movie about harry kanes career. God damn,3,27
UEFA European Championship 2024,"Man, Spain have played such beautiful football this entire tournament, I can't wait to see more of it in  years at the World Cup. Immensely well deserved victory!",0,13
UEFA European Championship 2024,Ball in play for  seconds of added time,27,3
UEFA European Championship 2024,"England stands back, England goes all out and dominates quite easily, England goes back to standing back and parking the bus
",27,0
UEFA European Championship 2024,Trent died for this Walker performance btw...,27,25
UEFA European Championship 2024,Spain has shown all tournament that it is possible to play attacking football at the international level. Deschamps and Southgate have no excuse for their terror ball with the squads they have.,27,3
UEFA European Championship 2024,"The better team won but Southgate needs to be sacked tomorrow. He's an utter coward and he's so far out of his depth. No balance on the pitch, parking the bus with just Rice in midfield, playing players who are clearly unfit or past their best, being on top and deciding to play all out of defence. Just absolutely awful decisions front to back, for his entire tenure he's been bailed out by individual brilliance and moments of luck. 

This team under a better manager can actually win something. Get him out.",11,9
UEFA European Championship 2024,That Olmo header on the line was the end.,27,4
UEFA European Championship 2024,That Scottish flag fellow finally has his wish come true haha.,1,17
UEFA European Championship 2024,Does Ed Sheeran still play in the locker room? Like just sad songs or not at all?,6,7
UEFA European Championship 2024,"Yamal's getting the spotlight for obvious reasons, but Williams was exceptional.

Utterly devastated.",9,0
UEFA European Championship 2024,"Until Southgate is here or he changes his style England will be having same result,  even though they have an exceptional squad.  



You can't always park the bus especially when you have attacking talent,  plus how he uses his tactics when rhey are trailing is also good and have mostly worked in his favor yet they can wait to go all out until they are behind.  Not to mention they just switch off post equalizing.  That's the worst. 



England need a coach with attacking intent",3,11
UEFA European Championship 2024,"We made a complete mistake in starting Kane and Foden  

Not a good performance from them all tournament


Palmer and Watkins showed their capability last game, it was obvious we had to start with them 
Get a goal and an assist and you still can't change the starting line up ? What if they got two assists or two goals, would he have changed it? 

Clearly not, his starting  was not changing 

What has Foden even done? Kane will win nothing ever, doesn't have it in him",3,10
UEFA European Championship 2024,"England made it this far in spite of Southgate, not because of him.",27,0
UEFA European Championship 2024,Who would've thought Pickford and his long balls to nobody wouldn't work.,27,3
UEFA European Championship 2024,"Harry Kane: one touch in the box across two Euro finals. 

Sounds about right. He's never there. When the ball is crossed in, he's plodding around  yards outside the box.",4,27
UEFA European Championship 2024,"Gareth needs to take a leaf out of the Spanish coaches book, Grimaldo was the best left back in Europe and he played Cucurella all tournament because he fit his system. 

Trying to shoe horn in foden Kane and Bellingham in one team was the downfall, they want to occupy the same space. If he'd played Gordon instead of foden I guarantee you Kane would've been so productive.",27,9
UEFA European Championship 2024,Shocked he blew right at . Spain was on the ground for almost half the  added mins,26,27
UEFA European Championship 2024,"Ah, to be a pub owner in Scotland right now...",27,22
UEFA European Championship 2024,"Football  My dad

Things that are never coming home",25,27
UEFA European Championship 2024,blowing on  after  minutes of timewasting is CRAZY by the way lmao,27,1
UEFA European Championship 2024,"Man, at this point I actually feel really sorry for England fans. Losing in every tournament is one thing, losing back-to-back finals is another.",24,25
UEFA European Championship 2024,"Spain deserved to win the tournament.

Often after tournaments I feel like one team got a rough go of it, but Spain was one of the only teams on point, and who didn't play negative and boring football.",4,22
UEFA European Championship 2024,Yeah let's defend while the score is equal then let's attack while we're losing. Then let's sit back when the score is equal again and then let's just lose  It sums up how England played this game. Can someone tell Southgate you have to attack and score above your opponent to win. England never want to win this game.,27,7
UEFA European Championship 2024,Foden is a system player never seen a player that's so bad for his national team always ghosts,9,27
UEFA European Championship 2024,"Kane is non existent, walker too sloppy, Bellingham looked absolutely exhausted",5,9
UEFA European Championship 2024,Funny but I think both teams would be much improved by switching Kane and Morata,1,17
UEFA European Championship 2024,"Foden even as a  he's not the most effective. Palmer has more to his game to be a . A  needs to be able to pass accurately to open up defences, Palmer can do that, Foden doesn't have that incisive pass in his locker. A  should be able to recieve/dribble in tight spaces and shoot well, both players can do that to be fair. But Foden's lack of assertion on a game is concerning. It's all easy when you have a world class Rodri shielding you in the PL and the likes of KDB giving you ball and creating acres of space for you to do some damage.",27,22
UEFA European Championship 2024,Why didn't Southgate throw the kitchen sink at Spain towards the end there? Ya know get whatever you can off the bench and try to draw it? It's not like the Spanish defense was rock solid.,10,9
UEFA European Championship 2024,"How did Spain suddenly become so good?! Watched them during euro qualifiers and they looked terrible, even lost to Scotland",7,6
UEFA European Championship 2024,The entire  minutes of stoppage the ball was out of play.,27,9
UEFA European Championship 2024,"Southgate hindered this team the entire tournament with his setup, team selection and subs... Cole Palmer the most in form player in the side does not start a single match yet he's responsible for  goal actions in the tournament!?!

IMHO any reasonably competent manager would have gotten this far with the talent in the English squad.

Imagine what Jose Morinho could have done with that team.

They needed someone to release the hand break and let them play aggressive attacking football. Sadly another opportunity missed",9,25
UEFA European Championship 2024,Expect nothing and you'll never be disappointed,5,20
UEFA European Championship 2024,Did anyone feel this Euro was a bit underwhelming?!,7,9
UEFA European Championship 2024,"Euro : England win the semifinal thanks to a controversial penalty, then lose the final  
Euro : England win the semifinal thanks to a controversial penalty, then lose the final

I'm sensing a pattern emerging",27,9
